"id","promotion","tri","nom","prenom","sexe","titre","notBefore","notAfter","authorKey","authorRef","ppn_position","ppn_these","an_these"
"199510","1995","dolle","Dolle","Catherine","2","Les écoles académiques de Valenciennes (1785-1914)","1785","1914","199510_dolle","","","",""
"199511","1995","emery","Emery","Armelle","2","Édition du <i>Vetus_Testamentum_versibus_latinis</i> par “Petrus episcopus”, une paraphrase en vers latins de l’Ancien_Testament","1200","1250","199511_emery","","","",""
"199512","1995","fieschi","Fieschi","Caroline","2","Photographie et botanique en France de 1839 à 1914","1839","1914","199512_fieschi","","","",""
"199513","1995","formont","Formont","Isabelle","2","La fin d’un duché-pairie : Sully-sur-Loire et les Béthune (1761-1807)","1761","1807","199513_formont","","","",""
"199514","1995","foucher","Foucher","Jean-Pascal","1","Genèse d’un espace royal : le Bois_de_Vincennes du <abbr>ix<sup>e</sup></abbr> au début du <abbr>xv<sup>e</sup></abbr> siècle","800","1499","199514_foucher","","","",""
"199515","1995","garcia","Garcia","Joëlle","2","Les représentations gravées du cardinal Mazarin au <abbr>xvii<sup>e</sup></abbr> siècle","1600","1699","199515_garcia","","","",""
"199516","1995","gascard","Gascard","Carole","2","L’enseignement du latin en France au <abbr>xvii<sup>e</sup></abbr> siècle, à travers les textes théoriques et les grammaires","1600","1699","199516_gascard","","","",""
"199517","1995","goudail","Goudail","Agnès","2","Art savoir et pouvoir : l’Académie des beaux-arts sous le Premier_Empire. Présentation et édition critique des procès verbaux (1811-1815)","1811","1815","199517_goudail","","","",""
"199518","1995","grand","Grand","Lucile","2","Maximien_Parchappe_de_Vinay (1800-1866), inspecteur général des asiles d’aliénés et du service sanitaire des prisons","1800","1866","199518_grand","","","",""
"199519","1995","heriche","Hériché","Sandrine","2","<i>Les_faictz_et_conquestes_d_Alexandre_le_Grand</i> de Jehan_Wauquelin (XV<sup>e</sup> siècle). Édition partielle et commentaire","1400","1499","199519_heriche","","","",""
"199520","1995","illiano","Illiano","Marie-Odile","2","Genèse d’une institution coloniale : les communes mixtes en Algérie (1868-1881)","1868","1881","199520_illiano","","","",""
"199521","1995","james","James","Ariane","2","Hyacinthe_Rigaud (1659-1743) ou le miroir de Clio","1659","1743","199521_james","","","",""
"199522","1995","jestaz","Jestaz","Juliette","2","Bernard_de_Montfaucon, mauriste et antiquaire : la tentative de l’Antiquité expliquée (1719-1725)","1719","1725","199522_jestaz","","","",""
"199523","1995","jezierski","Jezierski-Cartigny","Joëlle","2","La Porte de Paris, du <abbr>xiii<sup>e</sup></abbr> au <abbr>xvi<sup>e</sup></abbr> siècle. Étude topographique parisienne","1200","1599","199523_jezierski","","","",""
"199524","1995","lemaire","Lemaire","Alice","2","Le livre de plantes en France au <abbr>xvii<sup>e</sup></abbr> siècle (1593-1708)","1593","1708","199524_lemaire","","","",""
"199525","1995","lheureux","Lheureux-Icard","Rosine","2","Les parfumeurs entre 1860 et 1910 d’après les marques, dessins et modèles déposés à Paris","1860","1910","199525_lheureux","","","",""
"199526","1995","murat","Murat","David","1","Paul-Etienne_Devilliers_du_Terrage, directeur général de la police en Hollande d’après sa correspondance (1811-1914) avec le ministère de la Police générale","1811","1914","199526_murat","","","",""
"199527","1995","pedretti","Pedretti","Benoît-Joseph","1","L’édification d’un État de marine, ou la révolution des Colbert : les administrateurs de la marine marchande et militaire (1661-1690)","1661","1690","199527_pedretti","","","",""
"199528","1995","picaud","Picaud","Carine","2","La première Action catholique dans le diocèse de Vannes sous l’episcopat de Mgr_Guraud (1906-1928)","1906","1928","199528_picaud","","","",""
"199529","1995","piffault","Piffault","Olivier","1","“Les superbes et les humbles” entre la charité et le crédit populaire : le Mont-de-Piété de Paris (1777-1918)","1777","1918","199529_piffault","","","",""
"199530","1995","roelly","Roelly","Aude","2","Le Comité_des_fortifications de 1791 à 1800","1791","1800","199530_roelly","","","",""
"199531","1995","rostaing","Rostaing","Aurélia","2","André_Le_Nôtre et les jardins français du <abbr>xvii<sup>e</sup></abbr> siècle","1600","1699","199531_rostaing","","","",""
"199532","1995","sarazin","Sarazin","Jean-Yves","1","Clercs jurés, tabellions et notaires royaux à Châlons-sur-Marne au <abbr>xvi<sup>e</sup></abbr> siècle, de la tonsure aux écritures","1500","1599","199532_sarazin","","","",""
"199533","1995","thomine","Thomine","Alice","2","Joseph-Auguste-Emile_Vaudrener (1829-1914) : un architecte officiel au <abbr>xix<sup>e</sup></abbr> siècle","1829","1914","199533_thomine","","","",""
"199534","1995","urfels","Urfels","Anne-Élisabeth","2","Le sanctoral du lectionnaire de l’office dominicain (1254-1256)","1254","1256","199534_urfels","","","",""
"199535","1995","villela","Villela-Petit","Inès","2","La peinture médiévale vers 1400, autour d’un manuscrit de Jean_Lebègue. Édition des <i>Libri_colorum</i>","1390","1410","199535_villela","","","",""
"199536","1995","walravens","Walravens","Christelle","2","L’officialité épiscopale de Troyes à la fin du Moyen_Âge (1390-1500)","1390","1499","199536_walravens","","","",""
"199401","1994","bellon","Bellon","Cécile","2","La coseigneurie de Caderousse au Moyen_Âge","500","1499","199401_bellon","","","",""
"199402","1994","berstein","Berstein","Aline","2","L’abbaye de Chaalis. Édition et présentation du chartrier (1136-1204)","1136","1204","199402_berstein","","","",""
"199403","1994","beyeler","Beyeler","Christophe","1","Aspects de la mission de Lagarde, directeur général de la police de Toscane (octobre 1811-fevrier 1814)","1811","1814","199403_beyeler","","","",""
"199404","1994","bubenicek","Bubenicek","Michelle","2","Le pouvoir au féminin. Une princesse en politique et son entourage : Yolande_de_Flandre, comtesse de Bar et dame de Cassel (1326-1395)","1326","1395","199404_bubenicek","","","",""
"199405","1994","chablat","Chablat","Agnès","2","Une famille de financiers au <abbr>xvii<sup>e</sup></abbr> siècle : les Ardier, seigneurs de Beauregard","1600","1699","199405_chablat","","","",""
"199406","1994","delaforge","Delaforge-Marchand","Sandrine","2","Édition  du chartrier de l’abbaye de Saint-Antoine-des-Champs (1191-1256)","1191","1256","199406_delaforge","","","",""
"199407","1994","demerliac","Demerliac","Bérengère","2","Le conservatoire de musique de Paris de 1871 à 1905 : tradition et renouveau","1871","1905","199407_demerliac","","","",""
"199408","1994","doux","Doux","Florence","2","Les entreprises Léon_Ballot de 1902 à 1961 : contribution d’une entreprise familiale à l’évolution des barrages-voûtes en France","1902","1961","199408_doux","","","",""
"199409","1994","ducourtieux","Ducourtieux","Judith","2","Les plus anciennes chartes en langue française conservées aux archives départementales du Doubs (1260-1271)","1260","1271","199409_ducourtieux","","","",""
"199410","1994","eldin","Eldin","Grégoire","1","Les chapellenies à Notre-Dame de Paris (XII<sup>e</sup>-XVI<sup>e</sup> siècle). Recherches historiques et archéologiques","1100","1599","199410_eldin","","","",""
"199411","1994","granger","Granger","Catherine","2","La liquidation de la Liste civile de Napoléon_III (1870-1924)","1870","1924","199411_granger","","","",""
"199412","1994","guyard","Guyard","Patricia","2","Édition du cartulaire dit de Robert_Mignon (XIV<sup>e</sup>-XV<sup>e</sup> siècles)","1300","1499","199412_guyard","","","",""
"199413","1994","hagi","Hagi","Anne-Claire","2","Édition du cartulaire et du chartrier de l’archévêché de Besançon (1095-1268)","1095","1268","199413_hagi","","","",""
"199414","1994","kinossian","Kinossian","Yves","1","L’abbaye de Saint-Antoine et ses préceptories dans les diocèses de Vienne et de Grenoble (XIV<sup>e</sup>-XV<sup>e</sup> siècles)","1300","1499","199414_kinossian","","","",""
"199415","1994","lefebvre","Lefebvre","Emmanuelle","2","La fabrique de la cathédrale de Rouen. Présentation et édition des comptes (1406-1458)","1406","1458","199415_lefebvre","","","",""
"199416","1994","lemenn","Le Menn","Agnès","2","Jules-Raymond_de_Solier “premier écrivain général de la Provence”. Édition des <i>Rerum_Antiquarum_et_nobiliorum_Provinciae_commentarii</i>","1530","1599","199416_lemenn","","","",""
"199417","1994","maral","Maral","Alexandre","1","La chapelle royale de Versailles : le cadre archéologique et institutionnel et les cérémonies religieuses sous Louis_XIV","1650","1715","199417_maral","","","",""
"199418","1994","marchand","Marchand","Pierre","1","Le chapitre cathédral de Noyon (XI<sup>e</sup>-XIII<sup>e</sup> siècle) : organisation, pouvoir et temporel","1000","1299","199418_marchand","","","",""
"199419","1994","mouren","Mouren","Raphaële","2","Une édition de texte classique au <abbr>xvi<sup>e</sup></abbr> siècle : Piero_Vettori, Henri_Estienne et Eschyle (1557)","1557","1557","199419_mouren","","","",""
"199420","1994","plazannet","Plazannet","Fabien","1","Les sceaux gascons du Moyen_Âge","1000","1499","199420_plazannet","","","",""
"199421","1994","quereux","Quereux","Delphine","2","Les Tabard, fabricants de tapisserie à Aubusson de 1869 à 1983","1869","1983","199421_quereux","","","",""
"199422","1994","quernez","Quernez","Pierre","1","Philippe_de_Béthune (1565-1649), comte de Selles et de Charost : une longue vie au service du roi","1565","1649","199422_quernez","","","",""
"199423","1994","richard","Richard","Lisa","2","Les finances du duché d’Orléans et leur administration (1392-1440)","1392","1440","199423_richard","","","",""
"199424","1994","tessier","Tessier","Florence","2","La tradition manuscrite du traité de comput d’Helpéric d’Auxerre","900","999","199424_tessier","","","",""
"199425","1994","toulouse","Toulouse","Sarah","2","L’art de naviguer : hydrographie et cartographie marine en Normandie (1500-1650)","1500","1650","199425_toulouse","","","",""
"199426","1994","vandenneste","Van Den Neste","Évelyne","2","Joutes, tournois et pas d’armes dans les villes des Pays-Bas méridionaux à la fin du Moyen_Âge (1380-1486)","1380","1486","199426_vandenneste","","","",""
"199427","1994","vatican","Vatican","Agnès","2","Les conversions au catholicisme de protestants étrangers devant l’Inquisition espagnole (fin <abbr>xvi<sup>e</sup></abbr>-XVII<sup>e</sup> siècle)","1500","1699","199427_vatican","","","",""
"199428","1994","westeel","Westeel-Houste","Isabelle","2","Vie de saint_Éloi. Étude critique et édition","588","684","199428_westeel","","","",""
"199301","1993","barbance","Barbance","Céline","2","Édition critique du <i>Des_cas_des_nobles_hommes_et_femmes</i> (1409) de Laurent_de_Premierfait et commentaire linguistique","1409","1409","199301_barbance","","","",""
"199302","1993","boilloux","Boilloux","Marc","1","Un commentaire prophétique du <abbr>xiv<sup>e</sup></abbr> siècle : Jean_de_Roquetaillade et de l’Oracle_de_Cyrille (v. 1345-1349)","1345","1349","199302_boilloux","","","",""
"199303","1993","callu","Callu","Agnès","2","La réunion des musées_nationaux (1870-1940) : genèse et fonctionnement","1870","1940","199303_callu","","","",""
"199304","1993","cremer","Cremer","Luce","2","Paul_Lacroix (1806-1884), le « Bibliophile_Jacob » : une passion, une profession","1806","1884","199304_cremer","","","",""
"199305","1993","dangio","D’angio","Agnès","2","La politique de travaux publics du Groupe_Schneider de 1895 à 1949","1895","1949","199305_dangio","","","",""
"199306","1993","denis","Denis","Marie-Laure","2","Les états du Dauphiné de 1579 à 1628","1579","1628","199306_denis","","","",""
"199307","1993","filliozat","Filliozat","Manonmani","","D’Après de_Mannevilette, capitaine et hydrographe de la compagnie des Indes (1707-1780)","1707","1780","199307_filliozat","","","",""
"199308","1993","gueret","Gueret-Laferte","Judith","2","La représentation du livre dans l’enluminure franco-flamande des <abbr>xiv<sup>e</sup></abbr> et <abbr>xv<sup>e</sup></abbr> siècles","1300","1499","199308_gueret","","","",""
"199309","1993","hamm","Hamm","Frédérique","2","La traduction du <i>De_eruditione_filiorum_nobilium</i> de Vincent_de_Beauvais par Jean_Daudin","1364","1373","199309_hamm","","","",""
"199310","1993","heurtel","Heurtel-Thuillier","Pascale","2","Les fortifications de Paris au <abbr>xix<sup>e</sup></abbr> siècle","1800","1899","199310_heurtel","","","",""
"199311","1993","houdaille","Houdaille","Camille","2","L’abbaye de Saint-Denis-en-France aux <abbr>xvii<sup>e</sup></abbr> et <abbr>xviii<sup>e</sup></abbr> siècles","1600","1789","199311_houdaille","","","",""
"199312","1993","lescuyer","Lescuyer","Mathieu","1","Édition et étude du <i>Defensorium_mendicitatis_contra_Armachanum</i> de William_Woodford, O.F.M. (v. 1395)","1395","1395","199312_lescuyer","","","",""
"199313","1993","peyronnet","Peyronnet-Dryden, De","Florence","2","Stratégie familiale et société nobiliaire dans la chevalerie d’Empire de Franconie au <abbr>xviii<sup>e</sup></abbr> siècle : l’exemple de Christoph_Ludwig_von_Seckendorff (1709-1781)","1709","1781","199313_peyronnet","","","",""
"199314","1993","pompignoli","Pompignoli","Marie-Ange","2","<i>Guiron_le_Courtois.</i> Édition critique de la version de Jean_Vaillant","1200","1550","199314_pompignoli","","","",""
"199315","1993","poncet","Poncet","Olivier","1","Pomponne_de_Belièvre (1529-1607) : carrière, fortune, entourage d’un serviteur du roi","1529","1607","199315_poncet","","","",""
"199316","1993","rebetez","Rebetez","Jean-Claude","1","L’abbaye prémontrée de Bellelay  (1140-1420), histoire socio-économique d’une abbaye prémontrée jurassienne (précédée d’une analyse archivistique et diplomatique)","1140","1420","199316_rebetez","","","",""
"199317","1993","rech","Rech","Régis","1","Géraud_de_Frachet : l’engagement d’un historien au <abbr>xiii<sup>e</sup></abbr> siècle. Édition de sa <i>Chronique_universelle</i>","1200","1299","199317_rech","","","",""
"199318","1993","robain","Robain","Juliette","2","Château, châtellenies en Nouvelle Catalogne dans la région de Lérida de 1149 à 1213","1149","1213","199318_robain","","","",""
"199319","1993","sarmant","Sarmant","Thierry","1","Le Cabinet_des_médailles de la Bibliothèque_nationale de 1661 à 1848","1661","1848","199319_sarmant","","","",""
"199320","1993","thiboud","Thiboud","Noël","1","Le vignoble de Lons-le_Saunier au <abbr>xvii<sup>e</sup></abbr> siècle","1600","1699","199320_thiboud","","","",""
"199321","1993","vellet","Vellet","Christophe","1","De la marchandise à la prélature, carrière politique d’un homme de robe au service du roi : Antoine_Duprat (1463-1535)","1463","1535","199321_vellet","","","",""
"199322","1993","vergne","Vergne","Anne","2","Les Bénédictines à Paris aux <abbr>xvii<sup>e</sup></abbr> et <abbr>xviii<sup>e</sup></abbr> siècles","1600","1799","199322_vergne","","","",""
"199323","1993","viellard","Viellard-Lescuyer","Anne","2","Les actes en commandement du roi sous le règne personnel de Louis_XIV (1661-1715)","1661","1715","199323_viellard","","","",""
"199324","1993","weiss","Weiss","Valentine","2","Étude de topographie parisienne : la censive de Saint-Martin-des-Champs à Paris, du <abbr>xiii<sup>e</sup></abbr> siècle au début du <abbr>xv<sup>e</sup></abbr> siècle","1200","1450","199324_weiss","","","",""
"199201","1992","baehler","Baehler","Frédérique","2","L’administration du Musée_du_Louvre et la politique d’acquisition sous la restauration (1816-1830)","1816","1830","199201_baehler","","","",""
"199202","1992","beaugendre","Beaugendre","Anne-Caroline","2","Le <i>Livre_des_merveilles_du_monde</i>, ou <i>Secret_de_l_histoire_naturelle</i> (premier tiers du <abbr>xv<sup>e</sup></abbr> siècle). Édition critique","1400","1440","199202_beaugendre","","","",""
"199203","1992","belmon","Belmon","Jérôme","1","Les vicomtes de Rouergue-Millau (X<sup>e</sup>-XI<sup>e</sup> siècles)","900","1099","199203_belmon","","","",""
"199204","1992","bouffange","Bouffange","Serge","1","“Pro_Deo_et_patria”. Castermann : librairie et imprimerie (1776-1919)","1776","1919","199204_bouffange","","","",""
"199205","1992","burnel","Burnel","Anne","2","La Société_de_construction_des_Batignolles de 1914 à 1939 : histoire d’un déclin","1914","1939","199205_burnel","","","",""
"199206","1992","courtial","Courtial","Florence","2","Le théâtre du Vaudeville de 1848 à 1869","1848","1869","199206_courtial","","","",""
"199207","1992","dor","Dor","Marc-Antoine","1","Seigneurs en Île-de-France occidentale et en Haute-Normandie. Contributions à l’histoire des seigneurs de Montfort-l-Amaury, des comtes d’Évreux et de leur entourage au <abbr>xii<sup>e</sup></abbr> siècle et au début du <abbr>xiii<sup>e</sup></abbr> siècle","1100","1299","199207_dor","","","",""
"199208","1992","dumas","Dumas","Philippe","1","Le ministère du Commerce et de l’Industrie de 1899 à 1914","1899","1914","199208_dumas","","","",""
"199209","1992","duvigneau","Duvigneau","Marion","2","Les journaux d’agriculture pratique et d’économie rurale entre 1828 et 1848 : propagation des progrès agricole dans la France des notables","1828","1848","199209_duvigneau","","","",""
"199210","1992","etienne","Étienne","Michel","1","Le champagne Cliquot (1801-1813). Histoire d’une maison de négoce sous le Consulat et le Premier_Empire","1801","1813","199210_etienne","","","",""
"199211","1992","forstel","Förstel","Christian","1","Les grammaires grecques du <abbr>xv<sup>e</sup></abbr> siècle : étude sur les ouvrages de Manuel_Chrysolas, Théodore_Gaza et Constantin_Lascaris","1400","1499","199211_forstel","","","",""
"199212","1992","hofmann","Hofmann","Catherine","2","Justice et société dans le bailliage seigneurial de Saint-Denis en France pendant la seconde moitié du <abbr>xvii<sup>e</sup></abbr> siècle","1650","1699","199212_hofmann","","","",""
"199213","1992","latour","La Tour-Sevelinges, De","Hélène","2","Législation concernant les objets d’art (1887-1913) et création du service des Antiquités et Objets_d_Arts dans les premières années du <abbr>xx<sup>e</sup></abbr> siècle","1887","1913","199213_latour","","","",""
"199214","1992","lebars","Le Bars","Fabienne","2","L’activité de reliure-dorure à Paris au <abbr>xvi<sup>e</sup></abbr> siècle (1560-1585)","1560","1585","199214_lebars","","","",""
"199215","1992","malotaux","Malotaux","Sandrine","2","Le comte d’Angeveviller, directeur général des Bâtiments, “ministre des Beaux-Arts” (1774-1791)","1774","1791","199215_malotaux","","","",""
"199216","1992","marcerou","Marcerou","Philippe","1","André_Antoine et les auteurs dramatiques parisiens (1896-1939). Étude menée à partir de la correspondance reçue par André_Antoine","1896","1939","199216_marcerou","","","",""
"199217","1992","marcilloux","Marcilloux","Patrice","1","Géographie féodale du Limousin (XIV<sup>e</sup>-XV<sup>e</sup> siècles) : <i>li_quatre_vescomtat_de_Lemozi</i>","1300","1499","199217_marcilloux","","","",""
"199218","1992","mollet","Mollet","Vincent","1","Les archives départementales du Tarn de 1790 à 1946 : constitution et mise en valeur d’un patrimoine écrit","1790","1946","199218_mollet","","","",""
"199219","1992","rech","Rech","George","","Wisembach, une fonderie d’argent du <abbr>xvi<sup>e</sup></abbr> siècle","1500","1599","199219_rech","","","",""
"199220","1992","ricard","Ricard","Bruno","1","L’état et l’expansion commerciale de la France. L’information économique extérieure, des consuls aux conseillers commerciaux (1681-1939)","1681","1939","199220_ricard","","","",""
"199221","1992","rinckenbach","Rinckenbach","Alexis","1","Les chartes des évêques de Noyon, 1148-1221. Étude diplomatique et édition","1148","1221","199221_rinckenbach","","","",""
"199222","1992","rogeaux","Rogeaux","Nathalie","2","La lutte contre la tuberculose à Lille (1895-1940). Discours et réalité","1895","1940","199222_rogeaux","","","",""
"199223","1992","sengel","Sengel","Catherine","2","La séparation des Églises et de l’État, une chance pour le protestantisme en France ? (1905-1912)","1905","1912","199223_sengel","","","",""
"199224","1992","verdier","Verdier","Pascale","2","Édition du cartulaire de Renier_Acorre (1257-1281)","1257","1281","199224_verdier","","","",""
"199225","1992","vidal","Vidal","Colin","1","Les activités politiques de Joseph_Paul-Boncour de 1932 à 1936","1932","1936","199225_vidal","","","",""
"199226","1992","waille","Waille","Marie-Claire","2","Édition critique du <i>Palpanista</i> de Bernard_von_der_Geist","1240","1260","199226_waille","","","",""
"199101","1991","balley","Balley","Noëlle","2","« Autant qu’homme de France » : le rôle de Jacques_Lefèvre_d_Étaples dans la redécouverte et la diffusion des traductions latines de textes grecs (Paris, 1490-1525)","1490","1525","199101_balley","","","",""
"199102","1991","basques","Basques","Valérie","2","Le bureau des finances de Montauban et ses officiers (1635-1790)","1635","1790","199102_basques","","","",""
"199103","1991","borel","Borel","Nathalie","2","La version en trois livres de la <i>Fleur_des_histoires</i> de Jean_Mancel. Étude de la tradition manuscrite et édition partielle du livre III","1401","1473","199103_borel","","","",""
"199104","1991","brezet","Brezet","Bénédicte","2","Librairie et édition à Toulouse au <abbr>xix<sup>e</sup></abbr> siècle : la maison Privat (1849-1914)","1849","1914","199104_brezet","","","",""
"199105","1991","charon","Charon","Philippe","1","Les domaines de la maison d’Évreux-Navarre en Normandie, 1298-1385","1298","1385","199105_charon","","","",""
"199106","1991","dumont","Dumont","Céline","2","L’abbaye de Saint-Quentin de Beauvais (XI<sup>e</sup>-XIII<sup>e</sup> siècle)","1000","1299","199106_dumont","","","",""
"199107","1991","faure","Faure","Hélène","2","La noblesse dans le diocèse de Carcassonne, du <abbr>xvi<sup>e</sup></abbr> siècle à la Révolution","1500","1789","199107_faure","","","",""
"199108","1991","fayet","Fayet","Sylvie","2","L’expression de la couleur dans les textes littéraires latins du <abbr>xii<sup>e</sup></abbr> siècle. Contribution au lexique et éléments d’un imaginaire","1100","1199","199108_fayet","","","",""
"199109","1991","gauthier","Gauthier","Bernard","1","Recherches sur l’image des Occidentaux dans l’historiographie byzantine du <abbr>xii<sup>e</sup></abbr> siècle","1100","1199","199109_gauthier","","","",""
"199110","1991","georges","Georges","Nicolas","1","La maison Briansiaux (1796-1803): aux origines d’une réussite commerciale","1796","1803","199110_georges","","","",""
"199111","1991","gleize","Gleize","Jean-Michel","1","Édition critique des œuvres de François_Le_Roy, pour servir l’introduction à l’étude de la spiritualité fontevriste au moment de la réforme de l’ordre (1470-1530)","1470","1530","199111_gleize","","","",""
"199112","1991","guelfucci","Guelfucci","Emmanuelle","2","La naissance de l’École française de la harpe (1750-1825). Étude sociale et musicale","1750","1825","199112_guelfucci","","","",""
"199113","1991","guillaume","Guillaume","Caroline","2","Édition d’un recueil d’<i>exempla</i> du <abbr>xiv<sup>e</sup></abbr> siècle, le <i>Speculum_exemplare</i> ou <i>Liber_ad_status</i>","1300","1399","199113_guillaume","","","",""
"199114","1991","hochuli","Hochuli-Dubuis","Paule","2","Assistance et assistés à l’hôpital général de Genève à la fin du <abbr>xiv<sup>e</sup></abbr> siècle : les pauvres des régions limitrophes (1582-1592)","1582","1592","199114_hochuli","","","",""
"199115","1991","jean","Jean","Mireille","2","La chambre_des_comptes de Lille (1477-1667) : l’institution et les hommes","1477","1667","199115_jean","","","",""
"199116","1991","lacousse","Lacousse","Magali","2","Le cardinal_de_Joyeuse (1562-1625)","1562","1625","199116_lacousse","","","",""
"199117","1991","limon","Limon","Marie-France","2","Les notaires au Châtelet de Paris sous le règne de Louis_XIV. Étude institutionnelle et sociale","1650","1715","199117_limon","","","",""
"199118","1991","lourme","Lourme","Damien","1","Chanoines, officiers et dignitaire du chapitre cathédrale de Cambrai (1357-1426). Étude prosopographique et institutionnelle","1357","1426","199118_lourme","","","",""
"199119","1991","pilleboue","Pilleboue","Frédérique","2","La Sainte-Chapelle de Bourges, sa maîtrise et ses musiciens (XV<sup>e</sup>-XVI<sup>e</sup> siècles)","1400","1599","199119_pilleboue","","","",""
"199120","1991","pipon","Pipon","Brigitte","2","L’Abbaye-aux-Bois en Picardie. Édition et présentation du chartrier (1202-1341)","1202","1341","199120_pipon","","","",""
"199121","1991","pontier","Pontier","Marie-Claire","2","Ax, un consulat pyrénéen au <abbr>xvii<sup>e</sup></abbr> siècle","1600","1699","199121_pontier","","","",""
"199122","1991","rouffaic","Rouffaic","Nathalie","2","Un épisode de la présence britannique en France : les Jacobites à Paris et à Saint-Germain-en-Laye (1688-1715)","1688","1715","199122_rouffaic","","","",""
"199123","1991","rozenthal","Rozenthal-Szende","Danielle","2","Matthias_Corvin, ou le mythe de la monarchie nationale chez Nicolas_Zrinyi (1620-1664)","1620","1664","199123_rozenthal","","","",""
"199124","1991","sibille","Sibille","Claire","2","Les archevêques de Bourges et le chapitre cathédral de 1482 à 1525","1482","1525","199124_sibille","","","",""
