"id","promotion","tri","nom","prenom","sexe","titre","notBefore","notAfter","authorKey","authorRef","ppn_position","ppn_these","an_these"
"196719","1967","schillinger","Schillinger","Philippe","1","Les relations politiques des ducs de Lorraine et de la cité de Metz au <abbr>xv<sup>e</sup></abbr> siècle","1400","1499","196719_schillinger","","","",""
"196720","1967","tacetti","Tacetti","Jean","1","Le traité <i>De_sacramentis_numerorum_a_ternario_usque_ad_duodenarium</i> de Guillaume_d_Auberive : édition critique et commentaire","1100","1180","196720_tacetti","","","",""
"196721","1967","uginet","Uginet","François-Charles","1","Conflans en Savoie et son mandement du <abbr>xii<sup>e</sup></abbr> au <abbr>xv<sup>e</sup></abbr> siècle","1100","1499","196721_uginet","","","",""
"196601","1966","aiache","Aiache","Mauricette","2","Les versions françaises en prose du <i>Roman_des_sept_sages</i>","1100","1499","196601_aiache","","","",""
"196602","1966","chatel","Chatel","Paule","2","La Chartreuse de Paris, 1252-1792","1252","1792","196602_chatel","","","",""
"196603","1966","delmas","Delmas","Bruno","1","Le chancelier Jacques_Angeli et la médecine à Montpellier au milieu du <abbr>xv<sup>e</sup></abbr> siècle","1400","1499","196603_delmas","","","",""
"196604","1966","deurbergue","Deurbergue","Maria","2","Les sceaux des dames jusqu’en 1350, spécialement en Île-de-France","1000","1350","196604_deurbergue","","","",""
"196605","1966","dresch","Dresch","Odile","2","Les couvents des minimes à Paris","1500","1789","196605_dresch","","","",""
"196606","1966","durand","Durand-Evrard","Françoise","2","Les relations franco-marocaines pendant le consulat de Louis_Chénier (1762-1782)","1762","1782","196606_durand","","","",""
"196607","1966","fardet","Fardet","Marc","1","Le rôle militaire de Nantes sous le gouvernement du duc de Mercœur (1582-1598)","1582","1598","196607_fardet","","","",""
"196608","1966","guttinger","Guttinger","Chantal","2","La chancellerie d’Humbert_II, dauphin de Viennois (1333-1349)","1333","1349","196608_guttinger","","","",""
"196609","1966","hollard","Hollard","Claude-France","2","L’ordre de Saint-Jean-de-Jérusalem dans le sud-est de la France de 1312 à 1373","1312","1373","196609_hollard","","","",""
"196610","1966","labonninieredebeaumont","La Bonniniere De Beaumont, De","Hugues","1","L’administration de la librairie et la censure des livres de 1700 à 1750","1700","1750","196610_labonninieredebeaumont","","","",""
"196611","1966","laine","Laine","Brigitte","2","La vie économique et sociale à Collioure de 1360 à 1490","1360","1490","196611_laine","","","",""
"196612","1966","merigot","Merigot","Lydia","2","La place de France et le lotissement de la couture du Temple à Paris, 1608-1630","1608","1630","196612_merigot","","","",""
"196613","1966","pouillon","Pouillon","Agnès","2","L’hôtel des reines de France Isabeau_de_Bavière et Marie_d_Anjou de 1386 à 1463","1386","1463","196613_pouillon","","","",""
"196614","1966","quetin","Quetin-Pierre","Catherine","2","Le métier de tapissier à Aubusson et à Felletin jusqu’en 1665","1500","1665","196614_quetin","","","",""
"196615","1966","tribolethardy","Tribolet-Hardy, De","Maurice","1","Le cartulaire de Montfaucon en Franche-Comté","1315","1499","196615_tribolethardy","","","",""
"196501","1965","brincard","Brincard","Henri","1","Les rapports diplomatiques de la France et de l’Angleterre après le traité de Paris (1763-1770)","1763","1770","196501_brincard","","","",""
"196502","1965","dang","Dang","Phuong Nghi","1","Les institutions du Viet-Nam au <abbr>xviii<sup>e</sup></abbr> siècle","1700","1799","196502_dang","","","",""
"196503","1965","esnos","Esnos","Geneviève","2","Jean_Le_Fèvre et le <i>Respit_de_la_mort</i>","1650","1706","196503_esnos","","","",""
"196504","1965","fierro","Fierro","Alfred","1","Les enquêtes de 1339 en Dauphiné et en Faucigny, intérêt démographique","1339","1339","196504_fierro","","","",""
"196505","1965","henrat","Henrat","Philippe","1","L’intendant général de marine François d’Usson_de_Bonrepaus et sa carrière jusqu’au bombardement de Gênes (1644-1684)","1644","1684","196505_henrat","","","",""
"196506","1965","isaac","Isaac","Françoise","2","Les célestins de Paris,  étude historique et archéologique","1352","1667","196506_isaac","","","",""
"196507","1965","leroy","Le Roy","Nicole","2","L’influence française en Bretagne (1213-1341) et les institutions privées bretonnes","1213","1341","196507_leroy","","","",""
"196508","1965","ollivier","Ollivier","Françoise","2","Documents linguistiques de la Picardie orientale (1214-1350)","1214","1350","196508_ollivier","","","",""
"196509","1965","pouillon","Pouillon","Agnès","2","L’hôtel de Marie_d_Anjou, reine de France, d’après les comptes de son hôtel (1422-1427)","1422","1427","196509_pouillon","","","",""
"196510","1965","ramiere","Ramiere","Arnaud","1","Documents linguistiques du Lauragais","800","1499","196510_ramiere","","","",""
"196511","1965","tranthuan","Tran-Thuan-Biausse","Odile","2","Recueil des plus anciens actes de l’abbaye d’Yerres (1132-1265)","1132","1265","196511_tranthuan","","","",""
"196512","1965","tribolethardy","Tribolet-Hardy, De","Maurice","1","Le cartulaire de Montfaucon en Franche-Comté","1315","1499","196512_tribolethardy","","","",""
"196401","1964","bondeelle","Bondeelle-Souchier","Anne","2","La population de Sceaux de 1609 à 1749","1609","1749","196401_bondeelle","","","",""
"196402","1964","bonnin","Bonnin","Françoise","2","François_de_Dinteville, évêque d’Auxerre et ambassadeur de François_I<sup>er</sup> à Rome (1498-1554)","1498","1554","196402_bonnin","","","",""
"196403","1964","botineau","Botineau","Pierre","1","La chronique de Geoffroi_de_Breuil, prieur de Vigeois","994","1184","196403_botineau","","","",""
"196404","1964","boussel","Boussel","Odile","2","L’<i>Institutio_regia</i> de Jonas d’Orléans, un miroir des princes du <abbr>ix<sup>e</sup></abbr> siècle","800","999","196404_boussel","","","",""
"196405","1964","brandenburg","Brandenburg","Alain","1","Funérailles et sépultures royales en France de la fin du <abbr>viii<sup>e</sup></abbr> siècle à 1285","700","1285","196405_brandenburg","","","",""
"196406","1964","canut","Canut","Françoise","2","Le cartulaire de l’abbaye de Signy au diocèse de Reims, ordre de Cîteaux","1135","1499","196406_canut","","","",""
"196407","1964","combet","Combet","Marie-Thérèse","2","L’alliance franco-autrichienne sous les ministères de Choiseul (1756-1770)","1756","1770","196407_combet","","","",""
"196408","1964","dupouy","Dupouy","Lise","2","Les protestants de Florac de la révocation de l’Édit de Nantes à l’Édit de tolérance (1685-1787)","1685","1787","196408_dupouy","","","",""
"196409","1964","fontreaulx","Font-Reaulx, De","Anne","2","Présence française dans l’empire ottoman au <abbr>xviii<sup>e</sup></abbr> siècle : le baron de Tott (1733-1793)","1733","1793","196409_fontreaulx","","","",""
"196410","1964","geoffroy","Geoffroy","André","1","La vente des biens_nationaux dans le canton de Baugé. L’enquête de 1701 sur l’état de la librairie dans le royaume","1789","1801","196410_geoffroy","","","",""
"196411","1964","linguadesaintblanquat","Lingua De Saint-Blanquat, De","Agnès","2","Documents linguistiques du Comminges et du Couserans","800","1499","196411_linguadesaintblanquat","","","",""
"196412","1964","massot","Massot","Mireille","2","La fin de la présence militaire gênoise en Crimée d’après les archives gênoises (1453-1475)","1453","1475","196412_massot","","","",""
"196413","1964","miot","Miot","Francine","2","Les protestants en Aunis et en Saintonge de la révocation_de_l_Édit_de_Nantes à l’Édit_de_tolérance","1600","1699","196413_miot","","","",""
"196414","1964","perrot","Perrot","Serge","1","Catalogue des plus anciens actes concernant le temporel français de Saint-Evroult (1050-1214)","1050","1214","196414_perrot","","","",""
"196415","1964","poisle","Poisle","Danielle","2","La connaissance de la Chine en France au <abbr>xvii<sup>e</sup></abbr> siècle","1600","1699","196415_poisle","","","",""
"196416","1964","quetin","Quetin","Michel","1","L’hôpital d’Aurillac de 1649 à la Révolution","1649","1789","196416_quetin","","","",""
"196417","1964","rasoharinoro","Rasoharinoro","","","L’île_de_France de 1789 à 1803","1789","1803","196417_rasoharinoro","","","",""
"196301","1963","avisseau","Avisseau","Jean-Paul","1","Les prieurés de l’abbaye de Saint-Martial de Limoges","848","1791","196301_avisseau","","","",""
"196302","1963","avisseauroussat","Avisseau-Roussat","Hélène","2","L’hôpital Saint-Antoine_de_la_Charité_de_Pontorson (1644-1792)","1644","1792","196302_avisseauroussat","","","",""
"196303","1963","avril","Avril","François","1","La décoration des manuscrits dans les abbayes bénédictines de Normandie aux <abbr>xi<sup>e</sup></abbr> et <abbr>xii<sup>e</sup></abbr> siècles","1000","1199","196303_avril","","","",""
"196304","1963","avril","Avril-Lossky","Marie","2","Le renouvellement des icônes en Russie aux <abbr>xvi<sup>e</sup></abbr> et <abbr>xvii<sup>e</sup></abbr> siècles","1500","1699","196304_avril","","","",""
"196305","1963","baudouin","Baudouin","Marie-Noëlle","2","Forts et postes de commerce en Nouvelle-France au <abbr>xviii<sup>e</sup></abbr> siècle (1713-1763)","1713","1763","196305_baudouin","","","",""
"196306","1963","commanay","Commanay-Agnes","Colette","2","Recherches démographiques dans la châtellenie d’Aiguebelle d’après les comptes de subside de 1333 à 1450","1333","1450","196306_commanay","","","",""
"196307","1963","deschamps","Deschamps-Juif","Martine","2","L’historiographe André_Du_Chesne, 1584-1640","1584","1640","196307_deschamps","","","",""
"196308","1963","dufour","Dufour","Jean","1","La bibliothèque et le scriptorium de Moissac","600","1499","196308_dufour","","","",""
"196309","1963","dureau","Dureau-Lapeysonnie","Jeanne-Marie","2","L’œuvre d’Antoine_Ricart, médecin catalan du <abbr>xv<sup>e</sup></abbr> siècle ; contribution à l’étude des tentatives médiévales pour appliquer les mathématiques à la médecine","1400","1499","196309_dureau","","","",""
"196310","1963","fayard","Fayard","Janine","2","Hambourg et la France de 1661 à 1716 et le rôle des Bidal d’Asfeld","1661","1716","196310_fayard","","","",""
"196311","1963","gaborit","Gaborit","Jean-René","1","L’architecture de l’ordre_de_Grandmont","1076","1772","196311_gaborit","","","",""
"196312","1963","grand","Grand","Philippe","1","Les quolibets I et XIV de Gérard_d_Abbeville, maître en théologie au <abbr>xiii<sup>e</sup></abbr> siècle : édition, avec introduction et commentaire","1225","1272","196312_grand","","","",""
"196313","1963","hillard","Hillard-Villard","Denise","2","Les relations diplomatiques entre Charles_VII et Philippe_le_Bon de 1435 à 1445","1435","1445","196313_hillard","","","",""
"196314","1963","lacour","Lacour","Jacques","1","Le duché de Montpensier (1559-1789)","1559","1789","196314_lacour","","","",""
"196315","1963","limacher","Limacher","Pierrette","2","Le général Bourcet et la géographie des Alpes, 1748-1760","1748","1760","196315_limacher","","","",""
"196316","1963","mallison","Mallison","Wolfram","1","L’office divin à Cluny et l’ordinaire de Raymond_de_Cadoène (1410)","1410","1410","196316_mallison","","","",""
"196317","1963","maury","Maury","Cécile","2","Herbiers en français du <abbr>xv<sup>e</sup></abbr> siècle : le <i>Livre_des_simples_médecines_et_le_Grand_herbier_en_francoys</i>","1400","1499","196317_maury","","","",""
"196318","1963","neveu","Neveu","Bruno","1","Port-Royal et l’histoire : Sébastien_Le_Nain_de_Tillemont (1637-1698)","1637","1698","196318_neveu","","","",""
"196319","1963","poupardin","Poupardin","Claire","2","Étude sur les fortifications de Charles_V à Paris","1356","1370","196319_poupardin","","","",""
"196320","1963","roudiere","Roudiere-Dejean","Simone","2","Rôle politique du Parlement de Bordeaux sous le règne de Henri_III de 1574 à 1582","1574","1582","196320_roudiere","","","",""
"196321","1963","viallard","Viallard","Eliane","2","Les comtes de Forez et la frontière auvergnate de leur comté (1173-1372)","1173","1372","196321_viallard","","","",""
"196322","1963","weill","Weill","Georges","1","Le patriciat de Strasbourg à la fin du Moyen_Âge","1200","1499","196322_weill","","","",""
"196201","1962","alcouffe","Alcouffe","Daniel","1","Les artisan décorateurs du bois au faubourg Saint-Antoine, sous le règne de Louis_XIV, d’après les minutes des notaires parisiens","1650","1715","196201_alcouffe","","","",""
"196202","1962","angremy","Angremy","Annie","2","Les œuvres poétiques de Pierre_de_Beauvais","1200","1299","196202_angremy","","","",""
"196203","1962","avignac","Avignac","Jean","1","Jean_Pellet, commerçant de gros : contribution à l’étude du négoce bordelais au <abbr>xviii<sup>e</sup></abbr> siècle","1700","1799","196203_avignac","","","",""
"196204","1962","bergeretfrouville","Bergeret Frouville, De","Christiane","2","Le vidomnat de Genève du <abbr>xii<sup>e</sup></abbr> à la fin du <abbr>xiv<sup>e</sup></abbr> siècle","1100","1399","196204_bergeretfrouville","","","",""
"196205","1962","bertheau","Bertheau","Solange","2","Les protestants du Moyen-Poitou sous le régime de l’Édit de Nantes (1598-1685)","1598","1685","196205_bertheau","","","",""
"196206","1962","bichelonne","Bichelonne","Françoise","2","Le comté de Bar après le traité de Bruges : la politique du comte Edouard_I<sup>er</sup> (1302-1336)","1302","1336","196206_bichelonne","","","",""
"196207","1962","cauchetaux","Cauchetaux-Chavannes","Marjolaine","2","Les sceaux des rois de France d’Hugues_Capet à François_I<sup>er</sup> (987-1547)","987","1547","196207_cauchetaux","","","",""
"196208","1962","colin","Colin","Hubert","1","Châteaux et forteresses au Moyen_Âge dans la région de Nancy","900","1499","196208_colin","","","",""
"196209","1962","denel","Denel","Francis","1","Pierre_Jeannin : le serviteur de Henri_IV et le « barbon » (vers 1540-22 mars 1623)","1540","1623","196209_denel","","","",""
"196210","1962","geoffroy","Geoffroy","André","1","Les biens_nationaux dans le district de Baugé (Maine-et-Loire)","1789","1801","196210_geoffroy","","","",""
"196211","1962","jestaz","Jestaz","Bertrand","1","Jules_Hardouin-Mansart : l’œuvre personnelle, les méthodes de travail et les collaborateurs","1646","1708","196211_jestaz","","","",""
"196212","1962","mesnil","Mesnil","Marie-Noëlle","2","L’administration forestière de la fin de l’Ancien_Régime à la réorganisation consulaire, spécialement dans l’arrondissement forestier de Fontainebleau","1774","1804","196212_mesnil","","","",""
"196213","1962","nardin","Nardin","Jean-Claude","1","La mise en valeur de l’île de Tobago (1763-1793)","1763","1793","196213_nardin","","","",""
"196214","1962","playoust","Playoust-Chaussis","Arlette","2","La vie religieuse dans le diocèse de Boulogne à la veille de la Révolution (1725-1790)","1725","1790","196214_playoust","","","",""
"196215","1962","roudiere","Roudiere-Dejan","Simone","2","Rôle politique et réglementaire du Parlement de Bordeaux sous le règne de Henri_III (1574-1582)","1574","1582","196215_roudiere","","","",""
"196216","1962","samoyault","Samoyault","Jean-Pierre","1","Le secrétariat des Affaires étrangères sous Louis_XV : bureaux, fonctionnement, personnel","1717","1774","196216_samoyault","","","",""
"196217","1962","scheurer","Scheurer","Rémy","1","La chancellerie de France et les écritures royales au temps de Charles_VIII et de Louis_XII (1483-1515)","1483","1515","196217_scheurer","","","",""
"196218","1962","sibertin","Sibertin-Blanc","Brigitte","2","Angélique_de_Saint-Jean_Arnaud_d_Andilly, d’après sa correspondance, de 1624 à 1669","1624","1669","196218_sibertin","","","",""
"196219","1962","verdure","Verdure","Nicole","2","La navigation sur la Saône aux <abbr>xvii<sup>e</sup></abbr> et <abbr>xviii<sup>e</sup></abbr> siècles","1600","1799","196219_verdure","","","",""
"196220","1962","verlet","Verlet","Colombe","2","Le clavecin à Paris. Sa facture et son rôle dans la vie sociale à l’époque classique","1600","1789","196220_verlet","","","",""
"196101","1961","chapu","Chapu","Philippe","1","Les châteaux du Berry du <abbr>x<sup>e</sup></abbr> au <abbr>xiv<sup>e</sup></abbr> siècle","900","1399","196101_chapu","","","",""
"196102","1961","chauleau","Chauleau","Liliane","2","L’histoire sociale de la Martinique de 1635 à 1715","1635","1715","196102_chauleau","","","",""
"196103","1961","cotton","Cotton","Françoise","2","La vie rurale en Revermont du milieu du <abbr>xiv<sup>e</sup></abbr> siècle à la fin du <abbr>xv<sup>e</sup></abbr> siècle","1300","1499","196103_cotton","","","",""
"196104","1961","ducrot","Ducrot","Ariane","2","Recherches su Jean-Baptiste_Lully (1632-1687) et sur les débuts de l’Académie royale de musique","1632","1687","196104_ducrot","","","",""
"196105","1961","gambier","Gambier","Alix","","L’industrie papetière en France au <abbr>xviii<sup>e</sup></abbr> siècle : étude économique d’après les archives du Contrôle général des finances et des Intendances","1700","1799","196105_gambier","","","",""
"196106","1961","gasparri","Gasparri","Françoise","2","L’écriture des actes de Louis_VI, Louis_VII et Philippe-Auguste","1108","1223","196106_gasparri","","","",""
"196107","1961","hiegel","Hiegel","Charles","1","L’industrie du sel en Lorraine du <abbr>ix<sup>e</sup></abbr> siècle au début du <abbr>xvii<sup>e</sup></abbr> siècle","800","1699","196107_hiegel","","","",""
"196108","1961","jeudy","Jeudy","Colette","2","L’enseignement grammatical de Remi_d_Auxerre","850","908","196108_jeudy","","","",""
"196109","1961","lafon","Lafon","Marie-Antoinette","2","Évolution politique et sociale de la ville de Nîmes de la fin du <abbr>xiii<sup>e</sup></abbr> siècle à la fin du <abbr>xiii<sup>e</sup></abbr> siècle (1272-1390)","1272","1390","196109_lafon","","","",""
"196110","1961","michel","Michel-Mulliez","Marie-Edmée","2","Le commerce du vin à Paris au <abbr>xvi<sup>e</sup></abbr> siècle (1515-1577)","1515","1577","196110_michel","","","",""
"196111","1961","parichet","Parichet","Jacques","1","Les éditions de Sophocle en Europe occidentale au <abbr>xvi<sup>e</sup></abbr> siècle","1500","1599","196111_parichet","","","",""
"196112","1961","pauly","Pauly-Charreyre","Elisabeth","2","La grande entreprise privilégiée sous Colbert","1665","1683","196112_pauly","","","",""
"196113","1961","playoust","Playoust","Pierre-Yves","1","La vie municipale à Colmar aux <abbr>xiii<sup>e</sup></abbr> et <abbr>xiv<sup>e</sup></abbr> siècles","1200","1399","196113_playoust","","","",""
"196114","1961","roset","Roset","Simone","2","Le <i>Liber_thesauri_occulti</i> de Pascalis_Romanus, traité d’interprétation des songes du <abbr>xii<sup>e</sup></abbr> siècle","1100","1199","196114_roset","","","",""
"196115","1961","rouault","Rouault","Madeleine","2","Les jubés des églises de Bretagne","1000","1499","196115_rouault","","","",""
"196116","1961","simon","Simon","Nicole","2","La vie économique et sociale à Caen de 1381 à 1416","1381","1416","196116_simon","","","",""
"196117","1961","sy","Sy","Seydou","","La tenure en parage dans les coutumes de l’ouest (Normandie, Touraine-Maine-Anjou et Bretagne) aux <abbr>xii<sup>e</sup></abbr> et <abbr>xiii<sup>e</sup></abbr> siècles","1100","1299","196117_sy","","","",""
"196118","1961","tyl","Tyl","Gillette","","Le port et la ville de Cherbourg au <abbr>xviii<sup>e</sup></abbr> siècle","1700","1799","196118_tyl","","","",""
"196001","1960","barbiche","Barbiche","Bernard","1","Étude sur l’œuvre de restauration financière de Sully, 1596-1610","1596","1610","196001_barbiche","","","",""
"196002","1960","blanc","Blanc","Marie-Annick","2","La confrérie Notre-Dame-de-l’Assomption et la vie paroissiale à Gisors de la fin du <abbr>xiv<sup>e</sup></abbr> siècle à la Révolution","1350","1789","196002_blanc","","","",""
"196003","1960","elissagaray","Elissagaray","Marie-Anne","2","La légende des Rois_Mages : édition de l’<i>Histoire_des_trois_rois</i> avec une introduction historique","1150","1350","196003_elissagaray","","","",""
"196004","1960","giard","Giard","Jean-Baptiste","1","La monnaie de Saint-Quentin au temps de Charles_VI et de Charles_VII (1385-vers 1447)","1385","1447","196004_giard","","","",""
"196005","1960","greleir","Greleir","Françoise","2","Le temporel de l’abbaye de Fontevrault dans le Haut-Poitou des origines à la réforme du <abbr>xv<sup>e</sup></abbr> siècle","1101","1499","196005_greleir","","","",""
"196006","1960","harle","Harle-D’ophove","Monique","2","Étude sur la forêt de Compiègne depuis la réformation de Colbert jusqu’à la Révolution","1665","1789","196006_harle","","","",""
"196007","1960","jullien","Jullien-Charels","Claude","2","Le commerce du bois de chauffage à Paris au <abbr>xvi<sup>e</sup></abbr> siècle avant le flottage","1500","1599","196007_jullien","","","",""
"196008","1960","laforgue","Laforgue","Annie","2","Jean-Baptiste_Larcher, sa vie, son œuvre","1600","1699","196008_laforgue","","","",""
"196009","1960","lereboullet","Lereboullet","Christiane","2","Recherches sur les confréries de métiers à Rouen du <abbr>xiii<sup>e</sup></abbr> au <abbr>xv<sup>e</sup></abbr> siècle","1200","1499","196009_lereboullet","","","",""
"196010","1960","mariotte","Mariotte","Jean-Yves","1","Les comtes de Bourgogne de la maison de Souabe : contribution à l’histoire bourguignonne  des Hohenstaufen","1156","1208","196010_mariotte","","","",""
"196011","1960","moulinier","Moulinier","Pierre","1","Le « sel du Rhône » au Moyen_Âge","500","1499","196011_moulinier","","","",""
"196012","1960","pelletier","Pelletier","Monique","2","Le Grand_Conseil de Charles_VIII à François_I<sup>er</sup> (1483-1547)","1483","1547","196012_pelletier","","","",""
"196013","1960","pinzuti","Pinzuti","Noël","1","Étude sur l’histoire économique et sociale d’Ajaccio aux <abbr>xvi<sup>e</sup></abbr> et <abbr>xvii<sup>e</sup></abbr> siècles","1500","1699","196013_pinzuti","","","",""
"196014","1960","ribault","Ribault","Jean-Yves","1","Saint-Pierre-et-Miquelon et la rivalité franco-anglaise à Terre-Neuve au <abbr>xviii<sup>e</sup></abbr> siècle","1700","1799","196014_ribault","","","",""
"196015","1960","waksman","Waksman","Bernard","1","Histoire des dépendances de l’abbaye de Saint-Bertin du <abbr>vii<sup>e</sup></abbr> à la fin du <abbr>x<sup>e</sup></abbr> siècle","600","999","196015_waksman","","","",""
"196016","1960","zundel","Zundel","Anne","2","Les routes en Haute-Alsace à la fin de Moyen_Âge","1200","1499","196016_zundel","","","",""
"195901","1959","berce","Bercé","Yves-Marie","1","Les soulèvements populaires dans le sud-ouest de la France sous le règne de Louis_XIII","1610","1643","195901_berce","","","",""
"195902","1959","brunerye","Brunerye","Marc","1","Recherches sur la technique de la banque pendant la deuxième moitié du <abbr>xviii<sup>e</sup></abbr> siècle","1750","1799","195902_brunerye","","","",""
"195903","1959","chazelas","Chazelas","Jean","1","Les livrets de prières privées du <abbr>ix<sup>e</sup></abbr> siècle","800","899","195903_chazelas","","","",""
"195904","1959","courtieu","Courtieu-Capt","Anne-Marie","2","La vigne dans la partie méridionale de l’ancien diocèse de Lausanne au Moyen_Âge","500","1499","195904_courtieu","","","",""
"195905","1959","daniel","Daniel-Feltin","Chantal","2","La vie économique et sociale dans la seigneurie de Delle sous l’administration de Mazarin (1658-1789)","1658","1789","195905_daniel","","","",""
"195906","1959","gantier","Gantier","Odile","2","Les possessions et les prieurés de l’abbaye de Marmoutier du <abbr>x<sup>e</sup></abbr> au <abbr>xiii<sup>e</sup></abbr> siècle","900","1299","195906_gantier","","","",""
"195907","1959","gasnault","Gasnault-Beis","Marie-Claire","2","Le diocèse de Sens à la fin du Moyen_Âge d’après les registres de visites","1200","1499","195907_gasnault","","","",""
"195908","1959","hayez","Hayez","Michel","1","Catalogue des actes des évêques de Cambrai antérieurs à 1167","0","1167","195908_hayez","","","",""
"195909","1959","lafforgue","Lafforgue","Annie","2","Les recherches historiques en Gascogne au <abbr>xviii<sup>e</sup></abbr> siècle : Jean-Baptiste_Larcher et ses émules","1700","1799","195909_lafforgue","","","",""
"195910","1959","naud","Naud","Gérard","1","<i>Arresta_lata_in_Parlamento</i>, décisions notables du Parlement de Paris recueillies par un praticien anonyme entre 1371 et 1376","1371","1376","195910_naud","","","",""
"195911","1959","parguez","Parguez","Guy","1","Le temporel de l’abbaye de Saint-Germain_d_Auxerre des origines au milieu du <abbr>xiii<sup>e</sup></abbr> siècle","800","1280","195911_parguez","","","",""
"195912","1959","pathe","Pathe","Françoise","2","Les généalogistes des ordres du roi au <abbr>xviii<sup>e</sup></abbr> siècle","1700","1799","195912_pathe","","","",""
"195913","1959","siguret","Siguret","Philippe","1","Les défenses militaires du Perche du <abbr>x<sup>e</sup></abbr> au <abbr>xiii<sup>e</sup></abbr> siècle","900","1299","195913_siguret","","","",""
"195801","1958","boisard","Boisard","Pierre","1","<i>Le_roman_de_Ponthus_et_Sidoine</i> et la famille de la Tour-Landry","1370","1430","195801_boisard","","","",""
"195802","1958","bonazzi","Bonazzi","Elisabeth","2","Saint-Jean-d’Angély de 1372 à 1453. Son histoire. Ses institutions","1372","1453","195802_bonazzi","","","",""
