"id","promotion","tri","nom","prenom","sexe","titre","notBefore","notAfter","authorKey","authorRef","ppn_position","ppn_these","an_these"
"191705","1917","jubert","Jubert","Paul","1","La forêt d’Yveline et la formation du domaine forestier de Rambouillet","500","1789","191705_jubert","","","",""
"191706","1917","macedegastine","Mace De Gastine","Jean","1","Le ban et l’arrière-ban, de la création des compagnies d’ordonnance au <abbr>xviii<sup>e</sup></abbr> siècle (1445-1758)","1445","1758","191706_macedegastine","","","",""
"191707","1917","marchesne","Marchesne","Charles","1","Essai sur l’organisation du Chapitre cathédral de Tours, des origines au Concordat de 1516","500","1516","191707_marchesne","","","",""
"191708","1917","pietressondesaintaubin","Pietresson De Saint-Aubin","","","Essai sur la formation et le développement topographiques de la ville de Troyes, jusqu’à l’année 1524","500","1524","191708_pietressondesaintaubin","","","",""
"191601","1916","espezel","Espezel, d’","Pierre","1","L’organisation militaire de la France pendant la première partie du <abbr>xvi<sup>e</sup></abbr> siècle","1500","1550","191601_espezel","","","",""
"191602","1916","fontreaulx","Font-Reaulx, De","Jacques","1","Étude et catalogue des actes des comtes de Poitou, ducs d’Aquitaine (778-1137)","778","1137","191602_fontreaulx","","","",""
"191401","1914","baubet","Baubet","Victor","1","Études historiques et archéologiques sur l’abbaye de la_Chaise-Dieu (1043-1516)","1043","1516","191401_baubet","","","",""
"191402","1914","bossuat","Bossuat","Robert","1","<i>Li_livres_d_Amours</i> de Drouart_la_Vache. Texte établi d’après le manuscrit unique de l’Arsenal, avec une introduction littéraire et philologique, un glossaire et une table des noms propres","1290","1290","191402_bossuat","","","",""
"191403","1914","boudet","Boudet","Paul","1","Le Chapitre de Saint-Dié, en Lorraine, des origines au <abbr>xvi<sup>e</sup></abbr> siècle","962","1599","191403_boudet","","","",""
"191404","1914","braibant","Braibant","Charles","1","Études sur le temporel urbain du monastère de Saint-Magloire de Paris","1138","1572","191404_braibant","","","",""
"191405","1914","deroy","Deroy","Maurice","1","Étude sur le régime de la forêt de Fontainebleau au Moyen_Âge et jusqu’à la Révolution","500","1789","191405_deroy","","","",""
"191406","1914","dieterlen","Dieterlen","Maurice","1","Études de diplomatique sur les actes privés et ducaux en Lorraine, du <abbr>xiii<sup>e</sup></abbr> au <abbr>xv<sup>e</sup></abbr> siècle","1200","1499","191406_dieterlen","","","",""
"191407","1914","loubatier","Loubatier","Raymond","1","L’archevêque et l’archevêché de Bourges au <abbr>xii<sup>e</sup></abbr> siècle.","1100","1199","191407_loubatier","","","",""
"191408","1914","luppe","Luppe, De","Charles","1","L’historien Paolo_Coimi, dit Paul_Emile (1455-environ 1529)","1455","1529","191408_luppe","","","",""
"191409","1914","lyon","Lyon","Ernest","1","Recherches historiques et juridiques sur la coutume de Poitou","1417","1417","191409_lyon","","","",""
"191410","1914","morel","Morel","Marc","1","Étude sur la langue des chartes de Cluny (X<sup>e</sup> siècle). Contribution à la chronologie des phénomènes linguistiques romans","900","999","191410_morel","","","",""
"191411","1914","pocquetduhautjusse","Pocquet Du Haut-Jusse","Barthélemy","1","Les relations de la Bretagne avec l’Angleterre sous le règne du duc François_II (1458-1488)","1458","1488","191411_pocquetduhautjusse","","","",""
"191412","1914","rey","Rey","Léon","1","Essai sur la conquête et la perte du Royaume_de_Naples par Louis_XII (1500-1504)","1500","1504","191412_rey","","","",""
"191301","1913","baudry","Baudry","François","1","La révocation de l ’édit de Nantes et le protestantisme au <abbr>xviii<sup>e</sup></abbr> siècle en Bas-Poitou","1700","1799","191301_baudry","","","",""
"191302","1913","berger","Berger","Eugène","1","Étude historique et archéologique sur l’abbaye de Saint-Père de Chartres","1000","1799","191302_berger","","","",""
"191303","1913","boucher","Boucher","François","1","Essai sur l’organisation et l’administration des Hôtels du Roi, de la Reine et du Dauphin sous Charles_VI (1380-1422)","1380","1422","191303_boucher","","","",""
"191304","1913","deloncle","Deloncle","Pierre","1","Étude topographique sur la censive de Saint-Germain-l’Auxerrois à Paris (XIII<sup>e</sup> siècle – 1740)","1200","1740","191304_deloncle","","","",""
"191305","1913","dermenghem","Dermenghem","Emile","1","Claude d’Annebault, maréchal et amiral de France sous François_I<sup>er</sup> et Henri_II","1495","1552","191305_dermenghem","","","",""
"191306","1913","gaucheron","Gaucheron","Roger","1","Étude sur Michel_Amelot et l’administration du commerce (1699-1724)","1699","1724","191306_gaucheron","","","",""
"191307","1913","girard","Girard","Georges","1","Le recrutement des troupes réglées pendant la guerre_de_la_Succession_d_Espagne","1701","1714","191307_girard","","","",""
"191308","1913","guigue","Guigue","Albert","1","Étude sur les origines de la commune de Lyon (1173-1320)","1173","1320","191308_guigue","","","",""
"191309","1913","lacroptedechanterad","La Cropte De Chanterad, De","Bertrand","1","Odet_de_Foix, vicomte de Lautrec (1483?-1528)","1483","1528","191309_lacroptedechanterad","","","",""
"191310","1913","laval","Laval","Eloi","1","Le droit_privé dans les coutumes de Quercy aux <abbr>xiii<sup>e</sup></abbr> et aux <abbr>xiv<sup>e</sup></abbr> siècles","1200","1399","191310_laval","","","",""
"191311","1913","lyon","Lyon","Ernest","1","Le « Coustumier_de_Poictou » du <abbr>xv<sup>e</sup></abbr> siècle. Étude du texte et essai d’édition critique","1400","1499","191311_lyon","","","",""
"191312","1913","macquartdeterline","Macquart De Terline","Joseph","1","Étude sur l’abbaye de Cercamp (ordre de Cîteaux, diocèse d’Amiens)","1000","1899","191312_macquartdeterline","","","",""
"191313","1913","reizler","Reizler","Stanislas","1","Les censeurs royaux et l’approbation des livres (1623-1791)","1623","1791","191313_reizler","","","",""
"191314","1913","vallet","Vallet","Henri","1","La culture classique dans Raoul_de_Praelles, d’après sa traduction avec commentaire de la Cité_de_Dieu de saint_Augustin","1370","1380","191314_vallet","","","",""
"191201","1912","baron","Baron","François","1","Le cardinal Pierre_de_Foix, le Vieux (1386-1464), et ses légations","1386","1464","191201_baron","","","",""
"191202","1912","biver","Biver","André","1","L’abbaye royale de Saint-Martin de Laon","500","1789","191202_biver","","","",""
"191203","1912","boucher","Boucher","François","1","La cathédrale de Toul. Essai archéologique","500","1799","191203_boucher","","","",""
"191204","1912","girod","Girod","Eugène","1","Charles_II, duc de Lorraine (1390-1431). Ses relations politiques avec la France et l’Empire, de 1390 au 24 octobre 1420","1390","1420","191204_girod","","","",""
"191205","1912","hellouindecenival","Hellouin De Cenival","Pierre","1","Henri_de_Valois, duc d’Anjou (1551-1573)","1551","1573","191205_hellouindecenival","","","",""
"191206","1912","jablonski","Jablonski","Jean","1","Le Comte d’Anjou, roman d’aventures du <abbr>xiv<sup>e</sup></abbr> siècle","1300","1399","191206_jablonski","","","",""
"191207","1912","jouanne","Jouanne","René","1","Étude sur la Chambre_des_comptes_d_Angers (1360?-1483)","1360","1483","191207_jouanne","","","",""
"191208","1912","loew","Loew","Jean","1","Louis_de_Gonzague, prince de Mantoue, duc de Nevers (1539-1595). Sa vie et ses écrits jusqu’en 1590","1539","1590","191208_loew","","","",""
"191209","1912","marx","Marx","Jean","1","L’Inquisition en Dauphiné, du <abbr>xiv<sup>e</sup></abbr> siècle au début du règne de François_I<sup>er</sup>","1300","1520","191209_marx","","","",""
"191210","1912","oudotdedainville","Oudot De Dainville","Maurice","1","Les travaux publics de la ville de Périgueux au <abbr>xiv<sup>e</sup></abbr> siècle","1300","1399","191210_oudotdedainville","","","",""
"191211","1912","roussier","Roussier","Paul","1","Étude historique sur la rivière de Maine ou Mayenne","-500","1900","191211_roussier","","","",""
"191212","1912","servant","Servant","Georges","1","Les compagnies de Saint-Christophe et des îles de l’Amérique (1626-1653)","1626","1653","191212_servant","","","",""
"191213","1912","verrier","Verrier","Jean","1","Essai archéologique sur l’église Saint-Séverin de Paris","1000","1899","191213_verrier","","","",""
"191101","1911","billioud","Billioud","Joseph","1","Les États du duché de Bourgogne jusqu’en 1498","1000","1498","191101_billioud","","","",""
"191102","1911","biver","Biver","André","1","Essai historique sur l’abbaye royale de Saint-Martin de Laon, des origines à l’union à l’évêché","500","1911","191102_biver","","","",""
"191103","1911","blum","Blum","Edgar","1","Contribution à l’histoire de la législation hypothécaire, sous l’Ancien_Régime","1500","1789","191103_blum","","","",""
"191104","1911","courtecuisse","Courtecuisse","Maximilien","1","La manufacture de draps fins Vanrobais au <abbr>xvii<sup>e</sup></abbr> et au <abbr>xviii<sup>e</sup></abbr> siècle","1600","1799","191104_courtecuisse","","","",""
"191105","1911","decq","Decq","Edouard","1","Essai sur les origines, l’histoire et l’organisation de l’administration des Eaux et Forêts dans le domaine royal jusqu’au <abbr>xvi<sup>e</sup></abbr> siècle","500","1599","191105_decq","","","",""
"191106","1911","deschamps","Deschamps","Paul","1","Étude sur l’histoire et l’organisation de l’abbaye de Sainte-Colombe de Sens, depuis son origine jusqu’à la fin du <abbr>xv<sup>e</sup></abbr> siècle","620","1499","191106_deschamps","","","",""
"191107","1911","despras","Despras","Pierre","1","Guillaume_Gouffier, seigneur de Bonnivet, amiral de France (1485-1525)","1485","1525","191107_despras","","","",""
"191108","1911","estienne","Estienne","Joseph","1","L’Hôpital général des pauvres de Paris, aux <abbr>xvii<sup>e</sup></abbr> et <abbr>xviii<sup>e</sup></abbr> siècles","1600","1799","191108_estienne","","","",""
"191109","1911","fournier","Fournier","Pierre","1","Étude sur l’administration d’Alfonse_de_Poitiers dans la Terre d’Auvergne","1220","1271","191109_fournier","","","",""
"191110","1911","lemoine","Lemoine","Henry","1","Essai archéologique et artistique sur l’abbaye Saint-Victor de Paris","1100","1790","191110_lemoine","","","",""
"191111","1911","luzu","Luzu","Roger","1","Essai sur la Réforme et la Ligue dans le Maine jusqu’au 2 décembre 1589","1500","1589","191111_luzu","","","",""
"191112","1911","mazeran","Mazeran","Georges","1","Essai sur la politique religieuse de Philippe_le_Bon dans les Pays-Bas","1419","1467","191112_mazeran","","","",""
"191113","1911","papinot","Papinot","André","1","Prêteurs et emprunteurs d’argent à Paris sous François_I<sup>er</sup>","1515","1547","191113_papinot","","","",""
"191114","1911","perrier","Perrier","Paul","1","Histoire du district d’Ancenis (1788-1800)","1788","1800","191114_perrier","","","",""
"191115","1911","peyrichou","Peyrichou","Léon","1","Un essai de réforme de la taille au <abbr>xviii<sup>e</sup></abbr> siècle dans la généralité de Limoges","1700","1799","191115_peyrichou","","","",""
"191116","1911","roman","Roman","Joseph-Charles","1","Les chartes de l’ordre dauphinois et provençal de Chalais","1101","1300","191116_roman","","","",""
"191117","1911","servant","Servant","Georges","1","Les voyages de l’abbé Carré, agent de Colbert en Orient (1666-1674)","1666","1674","191117_servant","","","",""
"191118","1911","valleryradot","Vallery-Radot","Jean","1","La cathédrale de Bayeux. Étude archéologique","1000","1911","191118_valleryradot","","","",""
"191119","1911","vaquier","Vaquier","André","1","La Grande Confrérie_Notre-Dame aux prêtres et aux bourgeois de Paris","1000","1799","191119_vaquier","","","",""
"191120","1911","waquet","Waquet","Henri","1","Essai sur l’organisation et l’histoire administratives d’un bailliage royal aux <abbr>xiii<sup>e</sup></abbr> et <abbr>xiv<sup>e</sup></abbr> siècles. Le bailliage de Vermandois","1200","1399","191120_waquet","","","",""
"191001","1910","aclocque","Aclocque","Geneviève","2","Études sur le commerce et l’industrie à Chartes, depuis le <abbr>xi<sup>e</sup></abbr> siècle jusqu’à la fin du ministère de Colbert","1000","1683","191001_aclocque","","","",""
"191002","1910","babelon","Babelon","Jean","1","La moralité de Bien_Advisé_et_Mal_Advisé, précédée d’une étude sur les moralités en général","1300","1499","191002_babelon","","","",""
"191003","1910","barennes","Barennes","Jean","1","La viticulture en Bordelais au Moyen_Âge","500","1499","191003_barennes","","","",""
"191004","1910","chobaut","Chobaut","Hyacinthe","1","Les institutions municipales dans le Comté_Venaissin, des origines à 1790","500","1790","191004_chobaut","","","",""
"191005","1910","chodrondecourcel","Chodron De Courcel","Valentin","1","Étude archéologique sur la cathédrale de Troyes","300","1700","191005_chodrondecourcel","","","",""
"191006","1910","colombie","Colombie","Joseph","1","Les institutions municipales de Castres du <abbr>xii<sup>e</sup></abbr> au <abbr>xvi<sup>e</sup></abbr> siècle","1100","1599","191006_colombie","","","",""
"191007","1910","deloncle","Deloncle","Pierre","1","Étude sur la censive de Saint-Germain-l’Auxerrois, à Paris au <abbr>xiii<sup>e</sup></abbr> et au <abbr>xiv<sup>e</sup></abbr> siècle","1200","1399","191007_deloncle","","","",""
"191008","1910","faucher","Faucher","Benjamin","1","Formaiton et organisation du département du Cantal (1789-an III)","1789","1796","191008_faucher","","","",""
"191009","1910","garric","Garric","Gabriel","1","Contribution à l’étude de la jeunesse de Du_Plessis-Mornay et de ses débuts dans la politique et la diplomatie (1549-1582) suivie de lettres inédites de Du_Plessis-Mornay conservées à la Bibliothèque_Nationale","1549","1582","191009_garric","","","",""
"191010","1910","gastineau","Gastineau","Marcel","1","Essai historique sur le cimetière des Saints-Innocents, depuis les origines jusqu’à 1786","1000","1786","191010_gastineau","","","",""
"191011","1910","godet","Godet","Marcel","1","La congrégation de Montaigu (1490-1580)","1490","1580","191011_godet","","","",""
"191012","1910","hirschauer","Hirschauer","Charles","1","Les États d’Artois, depuis leur origine jusqu’à la réconciliation des provinces wallonnes avec Philippe_II (1340-1579)","1340","1579","191012_hirschauer","","","",""
"191013","1910","huisman","Huisman","Georges","1","La Juridiction de la Municipalité parisienne, de saint_Louis à Charles_VII","1226","1461","191013_huisman","","","",""
"191014","1910","isnard","Isnard","Emile","1","Essai historique sur le Chapitre cathédral de Digne et sur Pierre_Gassendi, chanoine et prévôt (1177-1790)","1177","1790","191014_isnard","","","",""
"191015","1910","loirette","Loirette","Gabriel","1","La Juridiction municipale à Toulouse, au <abbr>xii<sup>e</sup></abbr> et au <abbr>xiii<sup>e</sup></abbr> siècle, étude de droit urbain et d’administration judiciaire","1100","1299","191015_loirette","","","",""
"191016","1910","loncle","Loncle","Maurice","1","L’Ordre des Avocats au Parlement de Paris, aux <abbr>xvii<sup>e</sup></abbr> et au <abbr>xvii<sup>e</sup></abbr> siècles (1602-1790)","1602","1790","191016_loncle","","","",""
"191017","1910","luzu","Luzu","Roger","1","Les réformes et les origines de la Ligue dans le Maine et principalement dans la ville du Mans","1500","1699","191017_luzu","","","",""
"191018","1910","mazeran","Mazeran","Georges","1","Essai sur la politique religieuse de Philippe_II dans les Pays-Bas","1550","1599","191018_mazeran","","","",""
"191019","1910","picharddupage","Pichard Du Page","René","1","Simon_Arnauld_de_Pomponne avant son ministère (1618-1671), étude sur sa jeunesse, sa carrière administrative et diplomatique","1618","1671","191019_picharddupage","","","",""
"191020","1910","rousset","Rousset","Maurice","1","Étude biographique sur Eudes_de_Sully, évêque de Paris (1197-1208)","1197","1208","191020_rousset","","","",""
"191021","1910","royer","Royer","Louis","1","L’abbaye de Montmajour-lez-Arles, du <abbr>x<sup>e</sup></abbr> au <abbr>xv<sup>e</sup></abbr> siècle","900","1499","191021_royer","","","",""
"191022","1910","ruinaut","Ruinaut","Joseph","1","Essai historique sur les origines et l’organisation de l’église Saint-Marcel de Paris (V<sup>e</sup> siècle – 1597)","400","1597","191022_ruinaut","","","",""
"190901","1909","bereux","Bereux","Jean","1","Compiègne, depuis la fondation de Saint-Corneille jusqu’à l’abolition de la Commune (877-1319)","877","1319","190901_bereux","","","",""
"190902","1909","bouard","Boüard, De","Alain ","1","Études de diplomatique sur les notaires du Châtelet de Paris, avec un aperçu historique sur les origines du notariat français","1000","1909","190902_bouard","","","",""
"190903","1909","bouvier","Bouvier","Pierre","1","Étude sur l’Hôtel-Dieu d’Orléans au Moyen_Âge et au <abbr>xvi<sup>e</sup></abbr> siècle","1000","1599","190903_bouvier","","","",""
"190904","1909","gebelin","Gebelin","François","1","Le gouvernement du maréchal de Matignon en Guyenne pendant l’interrègne (1589-1594)","1589","1594","190904_gebelin","","","",""
"190905","1909","graziani","Graziani","Paul","1","Maillebois et l’insurrection corse (1739-1742)","1739","1742","190905_graziani","","","",""
"190906","1909","guitard","Guitard","Eugène","1","L’école gothique religieuse du midi de la France","1100","1399","190906_guitard","","","",""
"190907","1909","lafond","Lafond","Jean","1","Essai sur le Béarn sous l’administration de l’intendant d’Etigny (1751-1767)","1751","1767","190907_lafond","","","",""
"190908","1909","lanco","Lanco","Pascal","1","Charles_le_Masle, évêque constitutionnel du département du Morbihan","1791","1793","190908_lanco","","","",""
"190909","1909","lebarroisdorgeval","Le Barrois D’orgeval","Gabriel","1","Le tribunal_des_maréchaux_de_France","1650","1789","190909_lebarroisdorgeval","","","",""
"190910","1909","lecureux","Lecureux","Lucien","1","Étude sur la Bouquechardière de Jean_de_Courcy","1340","1396","190910_lecureux","","","",""
"190911","1909","longnon","Longnon","Jean","1","Essai sur la chronique de Morée, édition de la version française précédée d’une introduction historique et philologique sur les diverses versions de cette chronique","1095","1333","190911_longnon","","","",""
"190912","1909","romier","Romier","Lucien","1","Études sur le rôle politique, administratif et militaire de Jacques d’Albon_de_Saint-André (1512-1562)","1512","1562","190912_romier","","","",""
"190913","1909","rousset","Rousset","Maurice","1","Étude biographique sur Eudes_de_Sully, évêque de Paris (1197-1208)","1197","1208","190913_rousset","","","",""
"190914","1909","salvini","Salvini","Joseph","1","L’application de la Pragmatique_Sanction sous Charles_VII et Louis_XI au Chapitre de Paris","1422","1483","190914_salvini","","","",""
"190915","1909","saulnier","Saulnier","Eugène","1","Le rôle politique du Cardinal_de_Bourbon (Charles_X)","1523","1590","190915_saulnier","","","",""
"190801","1908","artonne","Artonne","André","1","Étude sur le mouvement politique de 1314","1314","1314","190801_artonne","","","",""
"190802","1908","berniawski","Berniawski","Louis","1","Formation et organisation du département de l’Allier","1789","1908","190802_berniawski","","","",""
"190803","1908","bondois","Bondois","Paul","1","Catalogue des actes de François_II, roi de France (10 juillet 1559-5 décembre 1560)","1559","1560","190803_bondois","","","",""
"190804","1908","brunel","Brunel","Clovis","1","Catalogue des actes de Ponthieu (XI<sup>e</sup> siècle – 1279)","1000","1279","190804_brunel","","","",""
"190805","1908","burnand","Burnand","Robert","1","L’Hôtel royal des Invalides (1674-1789)","1674","1789","190805_burnand","","","",""
"190806","1908","dupont","Dupont","Henri","1","Le Soissonnais de 1787 à 1790","1787","1790","190806_dupont","","","",""
"190807","1908","flicoteaux","Flicoteaux","Emmanuel","1","Étude sur les Eclogae et le Liber_officialis d’Amalaire précédées d’une notice biographique","775","850","190807_flicoteaux","","","",""
"190808","1908","fremy","Fremy","Elphège","","Essai sur la manufacture royale des glaces de France aux <abbr>xvii<sup>e</sup></abbr> et <abbr>xviii<sup>e</sup></abbr> siècle","1600","1799","190808_fremy","","","",""
"190809","1908","graziani","Graziani","Paul","1","La Provence au milieu du <abbr>xiii<sup>e</sup></abbr> siècle","1220","1280","190809_graziani","","","",""
"190810","1908","larde","Larde","Georges","1","Le tribunal du clerc dans l’empire_romain et la Gaule mérovingienne jusqu’en 614","-500","614","190810_larde","","","",""
"190811","1908","lavergne","Lavergne","Géraud","1","Le langage parlé en Bourbonnais aux <abbr>xiii<sup>e</sup></abbr> et <abbr>xiv<sup>e</sup></abbr> siècles","1200","1399","190811_lavergne","","","",""
"190812","1908","martin","Martin","André","1","Jean_le_Bègue, greffier de la Chambre_des_comptes de Paris","1368","1457","190812_martin","","","",""
"190813","1908","mathieu","Mathieu","Georges","1","Étude sur le marais de Bordeaux et de Bruges, de l’édit de 1599 à la Révolution","1599","1789","190813_mathieu","","","",""
"190814","1908","michel","Michel","Robert","1","Études sur la politique royale à l’égard de la noblesse et des villes consulaires dans la sénéchaussée de Beaucaire au temps de saint_Louis","1226","1270","190814_michel","","","",""
"190815","1908","mousset","Mousset","Albert","1","Le sieur de Longlée, résident de France à Madrid, et les relations officielles de la France et de l’Espagne de 1583 à 1589","1583","1589","190815_mousset","","","",""
"190816","1908","rhein","Rhein","André","1","La seigneurie de Montfort au diocèse de Chartres depuis l’origine jusqu’à la réunion au duché de Bretagne (X<sup>e</sup>-XIV<sup>e</sup> siècle)","900","1399","190816_rhein","","","",""
"190817","1908","sauvage","Sauvage","René-Norbert","1","L’abbaye de Saint-Martin de Troarn au diocèse de Bayeux, des origines au <abbr>xvi<sup>e</sup></abbr> siècle","500","1599","190817_sauvage","","","",""
"190818","1908","serpettedebersaucourt","Serpette De Bersaucourt","René","1","Philippe_de_Crèvecoeur, seigneur d’Esquerdes, maréchal de France (1434?-1494), essai biographique","1434","1494","190818_serpettedebersaucourt","","","",""
"190819","1908","valmont","Valmont","Gustave","1","Études sur le commerce des grains dans la généralité de Rouen au <abbr>xviii<sup>e</sup></abbr> siècle","1700","1799","190819_valmont","","","",""
"190820","1908","valois","Valois","Charles","1","Une histoire inédite de la Ligue, œuvre d’un contemporain anonyme (1574-1593)","1574","1593","190820_valois","","","",""
"190701","1907","aubert","Aubert","Marcel","1","La cathédrale de Senlis, étude archéologique","1151","1499","190701_aubert","","","",""
"190702","1907","canal","Canal","Séverin","1","Les origines de l’intendance de Bretagne","1689","1789","190702_canal","","","",""
"190703","1907","chevreux","Chevreux","Charles","1","La constitution communale d’Épinal sous la domination des évêques de Metz (983-1444)","983","1444","190703_chevreux","","","",""
"190704","1907","cochin","Cochin","Claude","","Étude sur Henry_Arnauld dans ses rapports sur le Jansénisme","1597","1692","190704_cochin","","","",""
"190705","1907","colmant","Colmant","Pierre","1","Les actes de l’abbaye de Marmoutier jusque vers le milieu du <abbr>xii<sup>e</sup></abbr> siècle","350","1150","190705_colmant","","","",""
"190706","1907","dauverne","Dauverne","Jules","1","L’abbaye de Saint-Médard de Soissons, des origines au <abbr>xiv<sup>e</sup></abbr> siècle","485","1399","190706_dauverne","","","",""
"190708","1907","desages","Desages","Charles","1","Essai sur la chronologie et la généalogie des comtes d’Angoulême, du milieu du <abbr>ix<sup>e</sup></abbr> siècle à la fin du <abbr>xi<sup>e</sup></abbr>","850","1110","190708_desages","","","",""
"190709","1907","destray","Destray","Paul","1","Étude sur les contestations de limites et les traités de neutralité entre la Franche-Comté et les terres françaises de Champagne et de Bourgogne jusqu’aux accords de 1612-1614","1612","1614","190709_destray","","","",""
"190710","1907","frevilledelorme","Freville De Lorme, De","Pierre","1","Essai sur les voies de recours devant l’Échiquier de Normandie au <abbr>xiv<sup>e</sup></abbr> siècle","1300","1399","190710_frevilledelorme","","","",""
"190711","1907","gautier","Gautier","Pierre","1","Catalogue des actes des évêques de Langres, précédé d’une introduction historique et diplomatique, du <abbr>vii<sup>e</sup></abbr> siècle à 1111","600","1111","190711_gautier","","","",""
"190712","1907","houdayer","Houdayer","Raymond","1","Les paysans de Cluny","909","1199","190712_houdayer","","","",""
"190713","1907","latouche","Latouche","Robert","1","Études sur le comté du Maine (820-1110)","820","1110","190713_latouche","","","",""
"190714","1907","maupassant","Maupassant, De","Jean","1","Relations de Pierre_IV_le_Cérémonieux, roi d’Aragon, avec la France, de 1340 à 1380","1340","1380","190714_maupassant","","","",""
"190715","1907","mun","Mun, De","Gabriel","1","L’ambassade de Particelli_d_Héméry en Piémont (1636-1639)","1636","1639","190715_mun","","","",""
